{
  "schema_version": 1,
  "revision": 1,
  "commitments": [
    {"id": "bootstrap-boundary", "kind": "constraint", "statement": "Only .project-compass/ may be changed by this bootstrap; preserve unrelated dirty work and ownership.", "status": "active", "source": {"ref": "conversation:2026-08-02-project-compass-fleet-bootstrap", "note": "User-authorized scope.", "observed_at": "2026-08-02T13:25:04Z"}},
    {"id": "public-portable-boundary", "kind": "decision", "statement": "The public catalog remains vendor-neutral and evidence-bounded; private context, host registration, and side effects require explicit operator authority.", "status": "active", "source": {"ref": "README.md", "note": "Portable workbench scope.", "observed_at": "2026-08-02T13:25:04Z"}}
  ],
  "reconciliations": [],
  "updated_at": "2026-08-02T13:25:04Z"
}
